City,Street,Lat,Long,Region,Partner,Bonus,Materials
Уфа,"Республика Башкортостан, г Уфа, пр-кт Октября, 7","54,7419","55,9872",Республика Башкортостан,Шоколадница,80 баллов за 1 кг,Пластик; Бумага
Уфа,"Республика Башкортостан, г Уфа, ул Александра Невского, 22","54,815966","56,097374",Республика Башкортостан,Шоколадница,80 баллов за 1 кг,Пластик; Бумага
Уфа,"Республика Башкортостан, г Уфа, ул Ермоловой, 37","54,6972","55,8147",Республика Башкортостан,Шоколадница,80 баллов за 1 кг,Пластик; Бумага
Уфа,"Республика Башкортостан, г Уфа, ул Комсомольская, 15",54,"55,7656",Республика Башкортостан,Шоколадница,80 баллов за 1 кг,Пластик; Бумага
Уфа,"Республика Башкортостан, г Уфа, ул Мелеузовская, 27 1","54,7689","56,2236",Республика Башкортостан,Шоколадница,80 баллов за 1 кг,Пластик; Бумага
Уфа,"Республика Башкортостан, г Уфа, ул Первомайская, 55","54,8125","56,0942",Республика Башкортостан,Шоколадница,80 баллов за 1 кг,Пластик; Бумага
Уфа,"Республика Башкортостан, г Уфа, ул Российская, 84","54,7775","56,0356",Республика Башкортостан,Шоколадница,80 баллов за 1 кг,Пластик; Бумага
Уфа,"Республика Башкортостан, г Уфа, ул Энтузиастов, 10","54,3856","56,7564",Республика Башкортостан,Шоколадница,80 баллов за 1 кг,Пластик; Бумага
Хабаровск,"Хабаровский край, г Хабаровск, ул Ангарская, 2 1","48,421335","135,103289",Хабаровский край,Шоколадница,80 баллов за 1 кг,Пластик; Бумага
Хабаровск,"Хабаровский край, г Хабаровск, ул Джамбула, 81","48,496587","135,04624",Хабаровский край,Шоколадница,80 баллов за 1 кг,Пластик; Бумага
Хабаровск,"Хабаровский край, г Хабаровск, ул Королева, 8",48,135,Хабаровский край,Шоколадница,80 баллов за 1 кг,Пластик; Бумага
Хабаровск,"Хабаровский край, г Хабаровск, ул Краснореченская, 58","48,3649","135,5678",Хабаровский край,Шоколадница,80 баллов за 1 кг,Пластик; Бумага
Хабаровск,"Хабаровский край, г Хабаровск, ул Муравьева-Амурского, 40","48,4774","135,0663",Хабаровский край,Шоколадница,80 баллов за 1 кг,Пластик; Бумага
Хабаровск,"Хабаровский край, г Хабаровск, ул Флегонтова, 2","48,4343","135,1064",Хабаровский край,Шоколадница,80 баллов за 1 кг,Пластик; Бумага
Чебоксары,"Чувашская республика, г Чебоксары, проезд Базовый, 5","56,1245","47,2511",Чувашская республика,Шоколадница,80 баллов за 1 кг,Пластик; Бумага
Чебоксары,"Чувашская республика, г Чебоксары, ул Ленинского Комсомола, 40","56,1125","47,2858",Чувашская республика,Шоколадница,80 баллов за 1 кг,Пластик; Бумага
Челябинск,"Челябинская область, г Челябинск, тракт Свердловский, 14 А 1","55,2292","61,3719",Челябинская область,Шоколадница,80 баллов за 1 кг,Пластик; Бумага
Челябинск,"Челябинская область, г Челябинск, ул Бажова, 89","55,183057","61,454652",Челябинская область,Шоколадница,80 баллов за 1 кг,Пластик; Бумага
Челябинск,"Челябинская область, г Челябинск, ул Ворошилова, 35","55,1918","61,3226",Челябинская область,Шоколадница,80 баллов за 1 кг,Пластик; Бумага
Челябинск,"Челябинская область, г Челябинск, ул Котина, 3","55,179096","61,455101",Челябинская область,Шоколадница,80 баллов за 1 кг,Пластик; Бумага
Челябинск,"Челябинская область, г Челябинск, ул Молодогвардейцев, 2","55,205441","61,321814",Челябинская область,Шоколадница,80 баллов за 1 кг,Пластик; Бумага
Челябинск,"Челябинская область, г Челябинск, ул Салавата Юлаева, 20","55,1891","61,2766",Челябинская область,Шоколадница,80 баллов за 1 кг,Пластик; Бумага
Челябинск,"Челябинская область, г Челябинск, ул Худякова, 8","55,147671","61,378268",Челябинская область,Шоколадница,80 баллов за 1 кг,Пластик; Бумага
Череповец,"Вологодская область, г Череповец, ул Ленинградская, 19 20","59,09863","37,923485",Вологодская область,Шоколадница,80 баллов за 1 кг,Пластик; Бумага
Чита,"Забайкальский край, г Чита, ул Бутина, 58","52,0445","113,5109",Забайкальский край,Шоколадница,80 баллов за 1 кг,Пластик; Бумага
Чита,"Забайкальский край, г Чита, ул Олимпийская, 6","52,0888","113,43717",Забайкальский край,Шоколадница,80 баллов за 1 кг,Пластик; Бумага
Шахты,"Ростовская область, г Шахты, ул Текстильная, 4","47,7311","40,2489",Ростовская область,Шоколадница,80 баллов за 1 кг,Пластик; Бумага
Энгельс,"Саратовская область, г Энгельс, ул Маяковского, 216","51,473987","46,101024",Саратовская область,Шоколадница,80 баллов за 1 кг,Пластик; Бумага
Якутск,"Республика Саха (Якутия), г Якутск, ул Октябрьская, пр.ленина31","62,025","129,7256",Республика Саха (Якутия),Шоколадница,80 баллов за 1 кг,Пластик; Бумага
Якутск,"Республика Саха (Якутия), г Якутск, ул Чернышевского, 66","62,0083","129,72",Республика Саха (Якутия),Шоколадница,80 баллов за 1 кг,Пластик; Бумага
Ярославль,"Ярославская область, г Ярославль, пр-кт Московский, 97","57,6001","39,875",Ярославская область,Шоколадница,80 баллов за 1 кг,Пластик; Бумага
Ярославль,"Ярославская область, г Ярославль, проезд Доброхотова, 1","57,6532","39,9458",Ярославская область,Шоколадница,80 баллов за 1 кг,Пластик; Бумага
Ярославль,"Ярославская область, г Ярославль, ул Красноборская, 1","57,6522","39,935",Ярославская область,Шоколадница,80 баллов за 1 кг,Пластик; Бумага
Ярославль,"Ярославская область, г Ярославль, ул Советская, 69","57,6406","39,8749",Ярославская область,Шоколадница,80 баллов за 1 кг,Пластик; Бумага
